"Datum a čas";Jméno;Telefon;Email;"Typ klienta";Společnost;"Typ služby";Zpráva;"IP adresa";"User Agent"
"2025-10-15 19:02:11";"Vitalij Beca";"+420 777 695 547";nimativ14@gmail.com;individual;;residential;;::1;"Mozilla/5.0 (Macintosh; Intel Mac OS X 10_15_7) AppleWebKit/537.36 (KHTML, like Gecko) Chrome/141.0.0.0 Safari/537.36"
"2025-10-15 19:23:55";"Vitalij Beca";"'+420 777 695 547";nimativ14@gmail.com;individual;;residential;;::1;"Mozilla/5.0 (Macintosh; Intel Mac OS X 10_15_7) AppleWebKit/537.36 (KHTML, like Gecko) Chrome/141.0.0.0 Safari/537.36"
"2025-10-15 19:34:23";"Vitalij Beca";"'+420 777 695 547";nimativ14@gmail.com;individual;;residential;;::1;"Mozilla/5.0 (Macintosh; Intel Mac OS X 10_15_7) AppleWebKit/537.36 (KHTML, like Gecko) Chrome/141.0.0.0 Safari/537.36"
"2025-10-16 21:05:48";Ana;"'+420 420 723 464";ana@gmail.com;company;"romanda work";residential;"Je potreba udelat dum pro pani Betsa a Pana Betsa, 170 m2 a z bazeinem
A poprosime to jakomoha richlej";192.168.0.17;"Mozilla/5.0 (Windows NT 10.0; Win64; x64; rv:144.0) Gecko/20100101 Firefox/144.0"
